{
  "schema_version": 2,
  "package_id": "ai-speaking-school",
  "upstream_targets": [],
  "targets": {
    "claude": {
      "support": "unsupported",
      "limitations": [
        "尚未创建或验证该平台 manifest"
      ]
    },
    "codex": {
      "support": "full",
      "manifest": {
        "path": ".codex-plugin/plugin.json",
        "authority": "local"
      },
      "marketplace": {
        "category": "Developer Tools",
        "installation": "AVAILABLE",
        "authentication": "ON_INSTALL"
      }
    }
  },
  "embedded_skills": {
    "speaking-head-teacher": {
      "standalone": {
        "claude": {
          "mode": "plugin_only",
          "reason": "尚未验证脱离 Plugin 根目录后的运行依赖"
        },
        "codex": {
          "mode": "plugin_only",
          "reason": "尚未验证脱离 Plugin 根目录后的运行依赖"
        }
      },
      "dependencies": []
    },
    "speaking-learning-analyst": {
      "standalone": {
        "claude": {
          "mode": "plugin_only",
          "reason": "尚未验证脱离 Plugin 根目录后的运行依赖"
        },
        "codex": {
          "mode": "plugin_only",
          "reason": "尚未验证脱离 Plugin 根目录后的运行依赖"
        }
      },
      "dependencies": []
    },
    "speaking-live-teacher": {
      "standalone": {
        "claude": {
          "mode": "plugin_only",
          "reason": "尚未验证脱离 Plugin 根目录后的运行依赖"
        },
        "codex": {
          "mode": "plugin_only",
          "reason": "尚未验证脱离 Plugin 根目录后的运行依赖"
        }
      },
      "dependencies": []
    },
    "speaking-teaching-assistant": {
      "standalone": {
        "claude": {
          "mode": "plugin_only",
          "reason": "尚未验证脱离 Plugin 根目录后的运行依赖"
        },
        "codex": {
          "mode": "plugin_only",
          "reason": "尚未验证脱离 Plugin 根目录后的运行依赖"
        }
      },
      "dependencies": []
    }
  },
  "local_paths": [
    ".codex-plugin/plugin.json"
  ]
}
