{
  "schema_version": 2,
  "package_id": "official-apply",
  "upstream_targets": [],
  "targets": {
    "claude": {
      "support": "unsupported",
      "limitations": [
        "尚未创建或验证该平台 manifest"
      ]
    },
    "codex": {
      "support": "full",
      "manifest": {
        "path": ".codex-plugin/plugin.json",
        "authority": "local"
      },
      "marketplace": {
        "category": "Productivity",
        "installation": "AVAILABLE",
        "authentication": "ON_INSTALL"
      },
      "limitations": [
        "自动登录复用使用项目保存状态和已连接的 Browser Bridge；动态 CDP 可通过明确指定来源的入口使用。",
        "Firefox、Safari 等没有可用导出接口的来源只登记，不代表可直接复用。",
        "范围写入目前支持 Moka 和飞书招聘；登录确认依赖网站现有适配器，未验证所有网站的迁移能力。"
      ]
    }
  },
  "embedded_skills": {
    "job-application-submit": {
      "standalone": {
        "claude": {
          "mode": "plugin_only",
          "reason": "尚未验证脱离 Plugin 根目录后的运行依赖"
        },
        "codex": {
          "mode": "plugin_only",
          "reason": "尚未验证脱离 Plugin 根目录后的运行依赖"
        }
      },
      "dependencies": []
    },
    "official-apply": {
      "standalone": {
        "claude": {
          "mode": "plugin_only",
          "reason": "尚未验证脱离 Plugin 根目录后的运行依赖"
        },
        "codex": {
          "mode": "plugin_only",
          "reason": "尚未验证脱离 Plugin 根目录后的运行依赖"
        }
      },
      "dependencies": []
    },
    "recruitment-capability-evolution": {
      "standalone": {
        "claude": {
          "mode": "plugin_only",
          "reason": "尚未验证脱离 Plugin 根目录后的运行依赖"
        },
        "codex": {
          "mode": "plugin_only",
          "reason": "尚未验证脱离 Plugin 根目录后的运行依赖"
        }
      },
      "dependencies": []
    },
    "recruitment-link": {
      "standalone": {
        "claude": {
          "mode": "plugin_only",
          "reason": "尚未验证脱离 Plugin 根目录后的运行依赖"
        },
        "codex": {
          "mode": "plugin_only",
          "reason": "尚未验证脱离 Plugin 根目录后的运行依赖"
        }
      },
      "dependencies": []
    },
    "recruitment-session": {
      "standalone": {
        "claude": {
          "mode": "plugin_only",
          "reason": "尚未验证脱离 Plugin 根目录后的运行依赖"
        },
        "codex": {
          "mode": "plugin_only",
          "reason": "尚未验证脱离 Plugin 根目录后的运行依赖"
        }
      },
      "dependencies": []
    },
    "resume-fill-review": {
      "standalone": {
        "claude": {
          "mode": "plugin_only",
          "reason": "尚未验证脱离 Plugin 根目录后的运行依赖"
        },
        "codex": {
          "mode": "plugin_only",
          "reason": "尚未验证脱离 Plugin 根目录后的运行依赖"
        }
      },
      "dependencies": []
    }
  },
  "local_paths": [
    ".codex-plugin/plugin.json"
  ]
}
