{
  "schema_version": 2,
  "package_id": "eli5",
  "upstream_targets": [
    "claude"
  ],
  "targets": {
    "claude": {
      "support": "full",
      "manifest": {
        "path": ".claude-plugin/plugin.json",
        "authority": "upstream"
      },
      "marketplace": {}
    },
    "codex": {
      "support": "full",
      "manifest": {
        "path": ".codex-plugin/plugin.json",
        "authority": "local"
      },
      "marketplace": {
        "category": "Developer Tools",
        "installation": "AVAILABLE",
        "authentication": "ON_INSTALL"
      }
    }
  },
  "embedded_skills": {
    "eli5": {
      "standalone": {
        "claude": {
          "mode": "plugin_only",
          "reason": "尚未验证脱离 Plugin 根目录后的运行依赖"
        },
        "codex": {
          "mode": "plugin_only",
          "reason": "尚未验证脱离 Plugin 根目录后的运行依赖"
        }
      },
      "dependencies": []
    }
  },
  "local_paths": [
    ".codex-plugin/plugin.json"
  ]
}
